<?xml version="1.0" encoding="UTF-8"?>
<!DOCTYPE mart PUBLIC "-//EBI//DTD MartBuilder 0.7-//EBI//DTD MartBuilder " "http://www.biomart.org/DTD/MartBuilder-0.7.dtd">
<mart outputDatabase="vega_mart_85" outputSchema="vega_mart_85" outputHost="localhost" outputPort="18002" overrideHost="ens-staging2" overridePort="3306" nameCase="0" hideMaskedDataSets="true" hideMaskedSchemas="false">
	<jdbcSchema uniqueId="1" driverClassName="com.mysql.jdbc.Driver" url="jdbc:mysql://localhost:24519/master_schema_88" databaseName="master_schema_88" schemaName="master_schema_88" username="ensadmin" password="ensembl" name="vega_gene" keyguessing="true" masked="false" hideMasked="true" partitionRegex="^(.)[^_]+_([^_]+)_vega_88_[0-9]*$" partitionExpression="$1$2">
		<table uniqueId="81" id="1" name="seq_region_synonym" ignore="false" inSchemaPartition="hsapiens,mmusculus,sscrofa,drerio,rnorvegicus">
			<column id="2" name="seq_region_id" visibleModified="false" inSchemaPartition="hsapiens,mmusculus,sscrofa,drerio,rnorvegicus"/>
			<column id="3" name="synonym" visibleModified="false" inSchemaPartition="hsapiens,mmusculus,sscrofa,drerio,rnorvegicus"/>
			<column id="4" name="seq_region_synonym_id" visibleModified="false" inSchemaPartition="hsapiens,mmusculus,sscrofa,drerio,rnorvegicus"/>
			<column id="5" name="external_db_id" visibleModified="false" inSchemaPartition="hsapiens,mmusculus,sscrofa,drerio,rnorvegicus"/>
			<primaryKey id="6" columnIds="4" status="INFERRED" visibleModified="false"/>
			<foreignKey id="7" columnIds="5" status="INFERRED" visibleModified="false"/>
			<foreignKey id="8" columnIds="2" status="INFERRED" visibleModified="false"/>
		</table>
		<table uniqueId="38" id="9" name="misc_feature_misc_set" ignore="false" inSchemaPartition="hsapiens,mmusculus,sscrofa,drerio,rnorvegicus">
			<column id="10" name="misc_feature_id" visibleModified="false" inSchemaPartition="hsapiens,mmusculus,sscrofa,drerio,rnorvegicus"/>
			<column id="11" name="misc_set_id" visibleModified="false" inSchemaPartition="hsapiens,mmusculus,sscrofa,drerio,rnorvegicus"/>
			<primaryKey id="12" columnIds="10,11" status="INFERRED" visibleModified="false"/>
			<foreignKey id="13" columnIds="11" status="INFERRED" visibleModified="false"/>
			<foreignKey id="14" columnIds="10" status="INFERRED" visibleModified="false"/>
		</table>
		<table uniqueId="33" id="15" name="marker_synonym" ignore="false" inSchemaPartition="hsapiens,mmusculus,sscrofa,drerio,rnorvegicus">
			<column id="16" name="marker_id" visibleModified="false" inSchemaPartition="hsapiens,mmusculus,sscrofa,drerio,rnorvegicus"/>
			<column id="17" name="name" visibleModified="false" inSchemaPartition="hsapiens,mmusculus,sscrofa,drerio,rnorvegicus"/>
			<column id="18" name="source" visibleModified="false" inSchemaPartition="hsapiens,mmusculus,sscrofa,drerio,rnorvegicus"/>
			<column id="19" name="marker_synonym_id" visibleModified="false" inSchemaPartition="hsapiens,mmusculus,sscrofa,drerio,rnorvegicus"/>
			<primaryKey id="20" columnIds="19" status="INFERRED" visibleModified="false"/>
			<foreignKey id="21" columnIds="16" status="INFERRED" visibleModified="false"/>
		</table>
		<table uniqueId="60" id="22" name="seq_region_attrib" ignore="false" inSchemaPartition="hsapiens,mmusculus,sscrofa,drerio,rnorvegicus">
			<column id="23" name="seq_region_id" visibleModified="false" inSchemaPartition="hsapiens,mmusculus,sscrofa,drerio,rnorvegicus"/>
			<column id="24" name="attrib_type_id" visibleModified="false" inSchemaPartition="hsapiens,mmusculus,sscrofa,drerio,rnorvegicus"/>
			<column id="25" name="value" visibleModified="false" inSchemaPartition="hsapiens,mmusculus,sscrofa,drerio,rnorvegicus"/>
			<foreignKey id="26" columnIds="24" status="INFERRED" visibleModified="false"/>
			<foreignKey id="27" columnIds="23" status="INFERRED" visibleModified="false"/>
		</table>
		<table uniqueId="92" id="28" name="transcript_intron_supporting_evidence" ignore="false" inSchemaPartition="hsapiens,mmusculus,sscrofa,drerio,rnorvegicus">
			<column id="29" name="transcript_id" visibleModified="false" inSchemaPartition="hsapiens,mmusculus,sscrofa,drerio,rnorvegicus"/>
			<column id="30" name="intron_supporting_evidence_id" visibleModified="false" inSchemaPartition="hsapiens,mmusculus,sscrofa,drerio,rnorvegicus"/>
			<column id="31" name="next_exon_id" visibleModified="false" inSchemaPartition="hsapiens,mmusculus,sscrofa,drerio,rnorvegicus"/>
			<column id="32" name="previous_exon_id" visibleModified="false" inSchemaPartition="hsapiens,mmusculus,sscrofa,drerio,rnorvegicus"/>
			<primaryKey id="33" columnIds="30,29" status="INFERRED" visibleModified="false"/>
			<foreignKey id="34" columnIds="29" status="INFERRED" visibleModified="false"/>
			<foreignKey id="35" columnIds="30" status="INFERRED" visibleModified="false"/>
		</table>
		<table uniqueId="13" id="36" name="dna_align_feature" ignore="false" inSchemaPartition="hsapiens,mmusculus,sscrofa,drerio,rnorvegicus">
			<column id="37" name="cigar_line" visibleModified="false" inSchemaPartition="hsapiens,mmusculus,sscrofa,drerio,rnorvegicus"/>
			<column id="38" name="external_data" visibleModified="false" inSchemaPartition="hsapiens,mmusculus,sscrofa,drerio,rnorvegicus"/>
			<column id="39" name="hcoverage" visibleModified="false" inSchemaPartition="hsapiens,mmusculus,sscrofa,drerio,rnorvegicus"/>
			<column id="40" name="hit_strand" visibleModified="false" inSchemaPartition="hsapiens,mmusculus,sscrofa,drerio,rnorvegicus"/>
			<column id="41" name="evalue" visibleModified="false" inSchemaPartition="hsapiens,mmusculus,sscrofa,drerio,rnorvegicus"/>
			<column id="42" name="seq_region_end" visibleModified="false" inSchemaPartition="hsapiens,mmusculus,sscrofa,drerio,rnorvegicus"/>
			<column id="43" name="hit_end" visibleModified="false" inSchemaPartition="hsapiens,mmusculus,sscrofa,drerio,rnorvegicus"/>
			<column id="44" name="analysis_id" visibleModified="false" inSchemaPartition="hsapiens,mmusculus,sscrofa,drerio,rnorvegicus"/>
			<column id="45" name="score" visibleModified="false" inSchemaPartition="hsapiens,mmusculus,sscrofa,drerio,rnorvegicus"/>
			<column id="46" name="seq_region_id" visibleModified="false" inSchemaPartition="hsapiens,mmusculus,sscrofa,drerio,rnorvegicus"/>
			<column id="47" name="perc_ident" visibleModified="false" inSchemaPartition="hsapiens,mmusculus,sscrofa,drerio,rnorvegicus"/>
			<column id="48" name="hit_start" visibleModified="false" inSchemaPartition="hsapiens,mmusculus,sscrofa,drerio,rnorvegicus"/>
			<column id="49" name="external_db_id" visibleModified="false" inSchemaPartition="hsapiens,mmusculus,sscrofa,drerio,rnorvegicus"/>
			<column id="50" name="seq_region_strand" visibleModified="false" inSchemaPartition="hsapiens,mmusculus,sscrofa,drerio,rnorvegicus"/>
			<column id="51" name="dna_align_feature_id" visibleModified="false" inSchemaPartition="hsapiens,mmusculus,sscrofa,drerio,rnorvegicus"/>
			<column id="52" name="seq_region_start" visibleModified="false" inSchemaPartition="hsapiens,mmusculus,sscrofa,drerio,rnorvegicus"/>
			<column id="53" name="hit_name" visibleModified="false" inSchemaPartition="hsapiens,mmusculus,sscrofa,drerio,rnorvegicus"/>
			<primaryKey id="54" columnIds="51" status="INFERRED" visibleModified="false"/>
			<foreignKey id="55" columnIds="44" status="INFERRED" visibleModified="false"/>
			<foreignKey id="56" columnIds="49" status="INFERRED" visibleModified="false"/>
			<foreignKey id="57" columnIds="46" status="INFERRED" visibleModified="false"/>
		</table>
		<table uniqueId="72" id="58" name="unmapped_object" ignore="false" inSchemaPartition="hsapiens,mmusculus,sscrofa,drerio,rnorvegicus">
			<column id="59" name="query_score" visibleModified="false" inSchemaPartition="hsapiens,mmusculus,sscrofa,drerio,rnorvegicus"/>
			<column id="60" name="parent" visibleModified="false" inSchemaPartition="hsapiens,mmusculus,sscrofa,drerio,rnorvegicus"/>
			<column id="61" name="identifier" visibleModified="false" inSchemaPartition="hsapiens,mmusculus,sscrofa,drerio,rnorvegicus"/>
			<column id="62" name="external_db_id" visibleModified="false" inSchemaPartition="hsapiens,mmusculus,sscrofa,drerio,rnorvegicus"/>
			<column id="63" name="target_score" visibleModified="false" inSchemaPartition="hsapiens,mmusculus,sscrofa,drerio,rnorvegicus"/>
			<column id="64" name="unmapped_reason_id" visibleModified="false" inSchemaPartition="hsapiens,mmusculus,sscrofa,drerio,rnorvegicus"/>
			<column id="65" name="ensembl_id" visibleModified="false" inSchemaPartition="hsapiens,mmusculus,sscrofa,drerio,rnorvegicus"/>
			<column id="66" name="type" visibleModified="false" inSchemaPartition="hsapiens,mmusculus,sscrofa,drerio,rnorvegicus"/>
			<column id="67" name="ensembl_object_type" visibleModified="false" inSchemaPartition="hsapiens,mmusculus,sscrofa,drerio,rnorvegicus"/>
			<column id="68" name="analysis_id" visibleModified="false" inSchemaPartition="hsapiens,mmusculus,sscrofa,drerio,rnorvegicus"/>
			<column id="69" name="unmapped_object_id" visibleModified="false" inSchemaPartition="hsapiens,mmusculus,sscrofa,drerio,rnorvegicus"/>
			<primaryKey id="70" columnIds="69" status="INFERRED" visibleModified="false"/>
			<foreignKey id="71" columnIds="68" status="INFERRED" visibleModified="false"/>
			<foreignKey id="72" columnIds="64" status="INFERRED" visibleModified="false"/>
			<foreignKey id="73" columnIds="62" status="INFERRED" visibleModified="false"/>
		</table>
		<table uniqueId="44" id="74" name="peptide_archive" ignore="false" inSchemaPartition="hsapiens,mmusculus,sscrofa,drerio,rnorvegicus">
			<column id="75" name="peptide_archive_id" visibleModified="false" inSchemaPartition="hsapiens,mmusculus,sscrofa,drerio,rnorvegicus"/>
			<column id="76" name="md5_checksum" visibleModified="false" inSchemaPartition="hsapiens,mmusculus,sscrofa,drerio,rnorvegicus"/>
			<column id="77" name="peptide_seq" visibleModified="false" inSchemaPartition="hsapiens,mmusculus,sscrofa,drerio,rnorvegicus"/>